{
  "$schema": "https://json-schema.org/draft/2020-12/schema",
  "$id": "https://agent-framework-java.dev/harness/change-summary.schema.json",
  "title": "ChangeSummary",
  "type": "object",
  "additionalProperties": false,
  "required": ["schemaVersion", "changedFiles", "publicContractImpact", "migrationNotes"],
  "properties": {
    "schemaVersion": { "const": "1.0" },
    "changedFiles": {
      "type": "array",
      "minItems": 1,
      "items": {
        "type": "object",
        "additionalProperties": false,
        "required": ["path", "changeType"],
        "properties": {
          "path": { "type": "string", "minLength": 1 },
          "changeType": { "enum": ["ADDED", "MODIFIED", "DELETED", "RENAMED"] }
        }
      }
    },
    "publicContractImpact": {
      "type": "object",
      "additionalProperties": false,
      "required": [
        "publicApiChanged",
        "sessionFormatChanged",
        "telemetryChanged",
        "dependencyChanged"
      ],
      "properties": {
        "publicApiChanged": { "type": "boolean" },
        "sessionFormatChanged": { "type": "boolean" },
        "telemetryChanged": { "type": "boolean" },
        "dependencyChanged": { "type": "boolean" }
      }
    },
    "migrationNotes": {
      "type": "array",
      "items": { "type": "string", "minLength": 1 }
    }
  }
}
